[
  {
    "id": "luoxian_fighter",
    "kind": "ally",
    "name_zh": "洛弦",
    "max_hp": 40,
    "stability_max": 10,
    "track": "front",
    "speed": 6,
    "action_ids": ["strike", "guard", "resonate_pulse"]
  },
  {
    "id": "misa_weaver",
    "kind": "ally",
    "name_zh": "弥砂",
    "max_hp": 30,
    "stability_max": 12,
    "track": "mid",
    "speed": 5,
    "action_ids": ["thread_bind", "guard", "mist_calm", "trap_snap"]
  },
  {
    "id": "drift_swarmling",
    "kind": "enemy_normal",
    "name_zh": "漂游幼群",
    "max_hp": 12,
    "stability_max": 6,
    "track": "front",
    "speed": 4,
    "action_ids": ["strike"],
    "drops": [
      {"item_id": "starsoil_dust", "amount": 2}
    ]
  },
  {
    "id": "shard_husk",
    "kind": "enemy_normal",
    "name_zh": "碎壳游荡者",
    "max_hp": 18,
    "stability_max": 8,
    "track": "mid",
    "speed": 5,
    "action_ids": ["strike", "shard_jolt"],
    "drops": [
      {"item_id": "starsoil_dust", "amount": 1},
      {"item_id": "lumen_shard", "amount": 1},
      {"item_id": "shock_trap", "amount": 1}
    ]
  },
  {
    "id": "veinwarden_echo",
    "kind": "enemy_elite",
    "name_zh": "脉守回响",
    "max_hp": 30,
    "stability_max": 10,
    "track": "mid",
    "speed": 6,
    "action_ids": ["strike", "vein_quake", "guard"],
    "drops": [
      {"item_id": "lumen_shard", "amount": 2}
    ]
  },
  {
    "id": "lumen_leviathan",
    "kind": "boss",
    "name_zh": "辉光利维坦",
    "max_hp": 60,
    "stability_max": 12,
    "track": "front",
    "speed": 7,
    "action_ids": ["strike", "vein_quake"],
    "phases": [
      {
        "id": "leviathan_p1",
        "at_hp_ratio": 0.5,
        "action_ids": ["lumen_surge", "vein_quake", "strike"]
      }
    ],
    "drops": [
      {"item_id": "echo_seed", "amount": 1},
      {"item_id": "resonant_core", "amount": 2}
    ]
  }
]
